{
  "schema": "orch.result/reviewer/v1",
  "verdict": "approve",
  "reviews_run_id": "impl-1",
  "blocking_findings": [],
  "non_blocking_findings": [
    {
      "body": "Consider renaming foo to fetchOnce"
    }
  ],
  "suggested_tests": [
    "bun test src/foo.test.ts"
  ],
  "run_id": "review-4"
}
