{
  "schema": "orch.result/reviewer/v1",
  "verdict": "request_changes",
  "reviews_run_id": "impl-1",
  "suggested_tests": [],
  "run_id": "review-3",
  "blocking_findings": [
    {
      "severity": "blocking",
      "finding": "Race in cache warmup",
      "scenario": "Two writers start within 10ms and both see an empty cache.",
      "body": "Race in cache warmup\n\nTwo writers start within 10ms and both see an empty cache.",
      "id": "finding-1",
      "file": "unspecified"
    },
    {
      "severity": "minor",
      "finding": "Typo in the log line",
      "body": "Typo in the log line",
      "id": "finding-2",
      "file": "unspecified"
    }
  ],
  "non_blocking_findings": []
}
